{
  "decision_id": "da-1",
  "node_id": "n-a3",
  "graph_id": "G-PRO",
  "capability_id": "orchestration.multi_runtime",
  "outcome": "DENY",
  "failing_axis": "PROVIDER_POLICY",
  "denial_reason": "PROVIDER_POLICY_DISALLOWED",
  "axis_results": {
    "entitlement": {
      "result": "PASS",
      "feature_admission_decision_id": "fa-ok"
    },
    "provider_auth": {
      "result": "PASS",
      "provider_id": "anthropic",
      "technical_status": "CONNECTED"
    },
    "provider_policy": {
      "result": "FAIL",
      "provider_policy_eligibility_id": "ppe-1",
      "policy_status": "VERIFIED_DISALLOWED",
      "execution_context": "THIRD_PARTY_LOCAL_EXTERNAL_WORKER"
    },
    "provider_availability": {
      "result": "PASS"
    },
    "safety": {
      "result": "PASS"
    },
    "quality_floor": {
      "result": "NOT_APPLICABLE"
    }
  },
  "selected_provider": null,
  "selected_runtime": null,
  "decided_at": "2026-08-15T00:00:00Z"
}
